"","X","ID","Person","Name","Description","Year","Address","pl_latitude","pl_longitude","Material","Is_sculptor","what_did","BirthDate","DeathDate","Gender","Wiki","Pl_Period","Pl_y"
"1",1,2805549264,"Абрамову Ф.А.","Фёдор Александрович Абрамов","В этом доме в 1982–1983 годах жил и работал писатель Федор Александрович Абрамов","1992"," Мичуринская ул./Санкт-Петербург, д. 1 ",59.953844,30.332259,"гранит",FALSE,"жил и работал",1920-02-29,1983-05-14,"мужской пол","Q468277","7. Federation",1992
"2",2,2805524742,"Авелану Ф.К.","Авелан, Фёдор Карлович","Здесь, в морской роте Александровского кадетского корпуса для малолетних, с 1850 по 1860 гг. воспитывалась плеяда выдающихся адмиралов Российского Флота, в их числе: Авелан К. Ф. [правильно - Ф. К (ред.)], Попов А.А., Римский-Корсаков В.А., Чихачев Г.П. [правильно - Н. М.(ред.)], Чухнин Г.П.","1997"," Кадетский бульв./Пушкин г., д. 1 ",59.709289,30.4022231,"гранит",TRUE,"учился",1839-09-12,1916-11-30,"мужской пол","Q3072690","7. Federation",1997
"3",3,2805531039,"Агееву Н.В.",NA,"В этом здании в период с 1925 по 1936 год работал академик Николай Владимирович Агеев","1989"," Политехническая ул./Санкт-Петербург, д. 29 ",60.0077249,30.3732928,"гранит",FALSE,"работал",NA,NA,NA,NA,"6. Perestroika",1989
"4",4,2805526222,"Азизбекову М.А ","Азизбеков, Азизага Мешади оглы","Технологи-революционеры, государственные деятели:Азизбеков Мешади Азизбек оглы 1876–1918,Бруснев Михаил Иванович 1864–1937,Ванеев Анатолий Александрович 1872–1899,Вологдин Валентин Петрович 1881–1953,Горбунов Николай Петрович 1892–1938,Гусев Сергей Иванович 1874–1933,Запорожец Петр Кузмич 1873–1905,Красин Леонид Борисович 1870–1926,Кржижановский Глеб Максимилианович 1872–1959,Лазо Сергей Георгиевич 1894–1920,Мартенс Людвиг Карлович 1875–1948,Петров Григорий Константинович 1892–1918,Радченко Степан Иванович 1869–1911,Сажин Михаил Петрович 1845–1934,Старков Василий Васильевич 1869–1925","1978"," Московский пр./Санкт-Петербург, д. 26/49 ",59.9183802,30.3182825,"мрамор",FALSE,NA,1903-04-27,1965-01-01,"мужской пол","Q16166598","5. Zastoi",1978
"5",5,2805549282,"Акимову Н.П.","Николай Павлович Акимов","В этом доме с 1945 г. по 1967 г. жил народный артист СССР Николай Павлович Акимов","1970"," Кирпичный пер./Санкт-Петербург, д. 1/4 ",59.9357908,30.3150342,"гранит",FALSE,"жил",1901-04-16,1968-09-06,"мужской пол","Q1185061","5. Zastoi",1970
"6",6,2805531051,"Алексееву В.М.","Василий Михайлович Алексеев","Здесь жил с 1939 по 1951 год академик Василий Михайлович Алексеев — крупнейший советский исследователь литературы, языка и культуры Китая","1959"," Лейтенанта Шмидта наб./Санкт-Петербург, д. 1/2 ",59.936509,30.285463,NA,FALSE,"жил",1881-01-14,1951-05-12,"мужской пол","Q921322","4. Ottepel",1959
"7",7,2805549310,"Алексееву В.И.","Виктор Ильич Алексеев","В этом доме с 1914 по 1975 год жил выдающийся спортивный педагог, заслуженный мастер спорта СССР, заслуженный тренер СССР, воспитавший плеяду замечательных советских легкоатлетов, Виктор Ильич Алексеев","1990"," Комсомола ул./Санкт-Петербург, д. 13 ",59.9551689,30.3673754,"гранит",TRUE,"жил",1914-09-09,1977-07-12,"мужской пол","Q50903","6. Perestroika",1990
"8",8,2805549322,"Алексееву В.И.","Виктор Ильич Алексеев","В этом здании работал заслуженный мастер спорта СССР, заслуженный тренер СССР Виктор Ильич Алексеев (1914–1977), основатель детской легкоатлетической школы “Зенит”","1982"," Раевского пр./Санкт-Петербург, д. 16 ",60.01326,30.3607151,"гранит",TRUE,"основал",1914-09-09,1977-07-12,"мужской пол","Q50903","5. Zastoi",1982
"9",9,2805526245,"Алексееву В.П.","Алексеев, Василий Петрович (революционер)","В этом цехе с 1911 по 1917 гг. работал токарем Вася Алексеев — организатор комсомола в Петрограде","1967"," Стачек пр./Санкт-Петербург, д. 47 ",59.8808948,30.2607868,"мрамор",FALSE,"работал",1896-12-22,1919-12-28,"мужской пол","Q4061633","5. Zastoi",1967
"10",10,2805526261,"Алексееву В.П.","Алексеев, Василий Петрович (революционер)","Вася Алексеев (1896–1919). Воспитанник нашего училища, токарь пушечной мастерской Путиловского завода, член большевистской партии с 1912 года, участник Октябрьской революции и Гражданской войны, один из организаторов Ленинского комсомола","1970"," Маршала Говорова ул./Санкт-Петербург, д. 18 ",59.882704,30.270126,"мрамор",TRUE,"учился",1896-12-22,1919-12-28,"мужской пол","Q4061633","5. Zastoi",1970
"11",11,2805531068,"Алексееву М.П.","Алексеев, Михаил Павлович","Здесь с 1966 по 1981 год жил и работал советский ученый-филолог, академик Михаил Павлович Алексеев","1986"," Лейтенанта Шмидта наб./Санкт-Петербург, д. 1/2 ",59.936509,30.285463,NA,FALSE,"жил и работал",1896-06-05,1981-09-19,"мужской пол","Q4061691","6. Perestroika",1986
"12",12,2805530337,"Алексееву С.В.","Алексеев, Сергей Венедиктович","В этой школе с 1970 по 1978 гг. учился воин, погибший, выполняя интернациональный долг в Афганистане, Алексеев Сергей Викторович","1989"," Московский пр./Санкт-Петербург, д. 203, лит. А ",59.84735,30.318189,"гранит",TRUE,"учился",1879-01-01,1957-01-01,"мужской пол","Q4061720","6. Perestroika",1989
"13",13,2805531090,"Амосову И.А.","Амосов, Иван Афанасьевич","Здесь учился выдающийся корабельный инженер И.А. Амосов (1800–1878). Построил первый в России винтовой корабль-фрегат “Архимед”","До 1978"," Адмиралтейский проезд/Санкт-Петербург, д. 2 ",59.938215,30.3092039,"мрамор",FALSE,"учился",1800-11-12,1878-06-01,"мужской пол","Q4064488","5. Zastoi",1978
"14",14,2805531099,"Ананьеву Б.Г.","Ананьев, Борис Герасимович","В этом доме с 1949 по 1972 жил видный советский психолог, действительный член Академии педагогических наук СССР Борис Герасимович Ананьев","1974"," Дибуновская ул./Санкт-Петербург, д. 31 ",59.985471,30.27235,"мрамор",FALSE,"жил",1907-08-14,1972-05-18,"мужской пол","Q4064804","5. Zastoi",1974
"15",15,2805549351,"Андрееву В.В.","Василий Васильевич Андреев","Здесь с 1912 по 1918 гг. жил и работал основатель оркестра русских народных инструментов Василий Васильевич Андреев","1956"," Мойки р. наб./Санкт-Петербург, д. 64 ",59.9318542,30.3115539,"мрамор",FALSE,"жил и работал",1861-01-15,1918-12-26,"мужской пол","Q982300","4. Ottepel",1956
"16",16,2805549371,"Андрееву В.В.","Василий Васильевич Андреев","20 марта 1888 года в этом здании состоялось первое выступление русского народного оркестра (“Кружка любителей игры на балалайках”) под управлением его создателя В.В. Андреева","1988"," Островского пл./Санкт-Петербург, д. 7 ",59.931815,30.334865,"гранит",FALSE,"выступал",1861-01-15,1918-12-26,"мужской пол","Q982300","6. Perestroika",1988
"17",17,2805549398,"Андрееву П.З.","Андреев, Павел Захарович","В этом доме с 1917 г. по 1950 г. жил выдающийся певец и педагог, народный артист СССР Павел Захарович Андреев","1967"," Писарева ул./Санкт-Петербург, д. 18 ",59.925685,30.2861119,"гранит",TRUE,"жил",1874-03-09,1950-09-15,"мужской пол","Q4065517","5. Zastoi",1967
"18",18,2805531115,"Андрееву С.Е.",NA,"Здесь с 1920 по 1930 год работал один из создателей института “Механобр” профессор Сергей Ефимович Андреев","1995","21-я линия В.О./Санкт-Петербург, д. 8, лит. А",59.934857,30.2640671,"гранит",FALSE,"работал",NA,NA,NA,NA,"7. Federation",1995
"19",19,2805531154,"Аничкову Н.Н.","Николай Николаевич Аничков","Здесь с 1920 по 1964 год работал крупнейший патолог страны академик Николай Николаевич Аничков","1968"," Академика Павлова ул./Санкт-Петербург, д. 9, лит. А ",59.978195,30.3121351,"гранит",TRUE,"работал",1885-11-03,1964-12-07,"мужской пол","Q655048","5. Zastoi",1968
"20",20,2805531128,"Аничкову Н.Н.","Николай Николаевич Аничков","В этом здании работал с 1909 по 1946 год академик Аничков Николай Николаевич — выдающийся советский патолог","1969"," Академика Лебедева ул./Санкт-Петербург, д. 37, лит. А ",59.9573447,30.3507002,"мрамор",FALSE,"работал",1885-11-03,1964-12-07,"мужской пол","Q655048","5. Zastoi",1969
"21",21,2805531166,"Аничкову С.В.","Аничков, Сергей Викторович","Здесь работал Герой Социалистического Труда, лауреат Ленинской и Государственной премий, академик АМН СССР Сергей Викторович Аничков — глава советской фармакологической школы, основатель и бессменный руководитель отдела фармакологии с 1948 по 1981 год","1982"," Академика Павлова ул./Санкт-Петербург, д. 12 ",59.977178,30.310573,"мрамор",FALSE,"основал",1892-09-20,1981-07-10,"мужской пол","Q4066431","5. Zastoi",1982
"22",22,2805530352,"Антонову Н.Д.",NA,"В этом доме с 1962 по 1986 год жил выдающийся военачальник, командир 2-го Гвардейского ленинградского истребительного авиакорпуса ПВО, гвардии генерал-полковник Николай Дмитриевич Антонов","1990"," Куйбышева ул./Санкт-Петербург, д. 1/5 ",59.954432,30.326757,"гранит",FALSE,"жил",NA,NA,NA,NA,"6. Perestroika",1990
"23",23,2805531177,"Аринкину М.И.","Михаил Иннокентьевич Аринкин","С 1931 по 1948 г. кафедру возглавлял выдающийся терапевт-гематолог Михаил Иннокентьевич Аринкин","1984"," Боткинская ул./Санкт-Петербург, д. 20 ",59.9584656,30.346604,"мрамор",FALSE,"руководил",1876-04-19,1948-08-30,"мужской пол","Q11778425","5. Zastoi",1984
"24",24,2805549446,"Асафьеву  Б.В.",NA,"В этом доме с 1933 по 1943 г. жил и работал Народный артист Союза ССР, академик Борис Владимирович Асафьев","1949"," Труда пл./Санкт-Петербург, д. 6 ",59.931364,30.293735,"мрамор",FALSE,"жил и работал",NA,NA,NA,NA,"3. Stalin time",1949
"25",25,2805531187,"Афанасьеву В.И.","Василий Иванович Афанасьев","Здесь учился и работал выдающийся инженер-механик В.И. Афанасьев (1843–1913). Установил основные законы движения судов","До 1977"," Адмиралтейский проезд/Санкт-Петербург, д. 2 ",59.938215,30.3092039,"мрамор",FALSE,"учился",1844-01-03,1913-10-19,"мужской пол","Q4072608","5. Zastoi",1977
"26",26,2805549459,"Ахматовой А.А.","Анна Андреевна Ахматова","Здесь, в здании бывшей Мариинской гимназии, с 1900 по 1905 гг. училась Анна Андреевна Ахматова","1989"," Леонтьевская ул./Пушкин г., д. 17 ",59.7196863,30.4039037,"бронза",TRUE,"учился",1889-06-23,1966-03-05,"женский пол","Q80440","6. Perestroika",1989
"27",27,2805549484,"Ахматовой А.А.","Анна Андреевна Ахматова","Музей Анны Ахматовой. “Фонтанный дом”","1989"," Фонтанки р. наб./Санкт-Петербург, д. 34 ",59.937344,30.3442622,"гранит",TRUE,NA,1889-06-23,1966-03-05,"женский пол","Q80440","6. Perestroika",1989
"28",28,2805531199,"Аше Б.М.",NA,"Лаборатория отопления и вентиляции основана в 1934 г. профессором Борисом Михайловичем Аше","1975"," 2-я Красноармейская ул./Санкт-Петербург, д. 4 ",59.915199,30.315244,"мрамор",FALSE,"основал",NA,NA,NA,NA,"5. Zastoi",1975
"29",29,2805526285,"Бабушкину И.В.",NA,"Здесь с 1887 по 1891 г. работал Иван Васильевич Бабушкин, один из первых рабочих-большевиков. Убит царскими палачами в 1906 г.","1970"," Макаровская ул./Кронштадт г., д. 2 ",59.9860362,29.7767517,"мрамор",TRUE,"работал",NA,NA,NA,NA,"5. Zastoi",1970
"30",30,2805531209,"Бабчину И.С.",NA,"В этом институте с 1938 по 1969 гг. работал выдающийся отечественный нейрохирург, профессор Бабчин Исаак Савельевич","1997"," Маяковского ул./Санкт-Петербург, д. 12 ",59.9340364,30.3540022,"гранит",TRUE,"работал",NA,NA,NA,NA,"7. Federation",1997
"31",31,2805531223,"Багалу Л.И.",NA,"Здесь в 1930–1969 гг. работал крупнейший специалист, профессор Л.И. Багал","1978"," Московский пр./Санкт-Петербург, д. 26/49 ",59.9183802,30.3182825,"мрамор",FALSE,"работал",NA,NA,NA,NA,"5. Zastoi",1978
"32",32,2805531233,"Байкову А.А.",NA,"Выдающийся русский ученый, металлург, химик, академик Александр Александрович Байков жил и работал в этом доме с 1930 г. по 1942 г.","1948"," Литейный пр./Санкт-Петербург, д. 10 ",59.9460157,30.3490454,"бронза",FALSE,"жил и работал",NA,NA,NA,NA,"3. Stalin time",1948
"33",33,2805531243,"Байкову А.А.",NA,"В этом здании в 1904–1946 годах работал академик Александр Александрович Байков","1978"," Политехническая ул./Санкт-Петербург, д. 29 ",60.0077249,30.3732928,"бронза",FALSE,"работал",NA,NA,NA,NA,"5. Zastoi",1978
"34",34,2805549514,"Балакиреву М.А.","Милий Алексеевич Балакирев","Здесь жил и скончался русский музыкальный деятель и композитор Милiй Алексеевич Балакирев (21 дек. 1836 — 16 мая 1910). Музыкально-историческое общество имени графа А.Д. Шереметева. Установлена в 1912 г. Возобновлена в 1957 г.","191"," Коломенская ул./Санкт-Петербург, д. 7 ",59.925618,30.353843,"мрамор",FALSE,"название в честь",1837-01-02,1910-05-29,"мужской пол","Q185040","Unknown period",NA
"35",35,2805549536,"Балыбердину В.С.","Балыбердин, Владимир Сергеевич","MOUNT EVEREST.Выдающийся альпинист — первый российский покоритель Эвереста 3–9 мая 1982 г. —Владимир Сергеевич Балыбердин (1949–1994) жил в этом доме с 1991 г.","1996"," Бассейная ул./Санкт-Петербург, д. 47 ",59.864069,30.3260379,"гранит",TRUE,"жил",1948-10-01,1994-07-22,"мужской пол","Q4077014","7. Federation",1996
"36",36,2805526305,"Барышеву Н.В.",NA,"В 1916–1924 гг. на заводе работал профессиональный революционер-ленинец Николай Васильевич Барышев (1880–1940), один из организаторов Красной гвардии Выборгской стороны, руководитель заводской партийной организации в период подготовки и проведения Октябрьского вооруженного восстания","1973"," Красногвардейский пер./Санкт-Петербург, д. 23 ",59.9837572,30.3187733,"мрамор",FALSE,"работал",NA,NA,NA,NA,"5. Zastoi",1973
"37",37,2805531257,"Бауману В.И.","Бауман, Владимир Иванович","Здесь с 1895 по 1923 год жил и работал профессор Владимир Иванович Бауман,выдающийся деятель горной науки, основоположник отечественной маркшейдерской школы и разведочной геофизики","1973"," Лейтенанта Шмидта наб./Санкт-Петербург, д. 45 ",59.929451,30.268748,"мрамор",FALSE,"жил и работал",1867-04-21,1923-03-15,"мужской пол","Q26693641","5. Zastoi",1973
"38",38,2805531271,"Бахерахту А.Г.","Бахерахт, Андрей Гаврилович","Видные военно-морские врачи, работавшие в госпитале:Бахерахт А. Г. 1758–1760 г.,Самойлович Д. С. 1775–1786 г.,Мудров М. Я. 1800–1802 г.,Кравченко В. С. 1908–1922 г.,Аннин В. П. 1910–1924 г.,Засосов Р. А. 1920–1924 г.,Лубо В. К. 1939–1945 г.,Сорокин С. И. 1917–1950 г.",NA," Старо-Петергофский пр./Санкт-Петербург, д. 2 ",59.9150593,30.2789276,NA,FALSE,"работал",1725-12-27,1806-01-01,"мужской пол","Q28114634","Unknown period",NA
"39",39,2805531283,"Бахурину И.М.","Бахурин, Иван Михайлович","Здесь в 1929–1940 годах работал видный ученый в области маркшейдерского дела, член-корреспондент Академии наук СССР, профессор Иван Михайлович Бахурин","1988"," Средний пр./Санкт-Петербург, д. 82 ",59.936272,30.257785,"мрамор",FALSE,"работал",1880-10-25,1940-10-02,"мужской пол","Q41574039","6. Perestroika",1988
"40",40,2805531299,"Бейльштейну Ф.Ф.","Фёдор Фёдорович Бейльштейн","Выдающиеся ученые, работавшие в институте:Бейльштейн Федор Федорович 1838–1906,Вышнеградский Иван Алексеевич 1831–1895,Гесс Герман Иванович 1802–1850,Гринберг Александр Абрамович 1898–1966,Коновалов Дмитрий Петрович 1856–1929,Лебедев Сергей Васильевич 1874–1934,Менделеев Дмитрий Иванович 1834–1907,Петров Николай Павлович 1836–1920,Порай-Кошиц Александр Евгеньевич 1877–1949,Фаворский Алексей Евграфович 1860–1945,Чугаев Лев Александрович 1873–1922,Чернов Дмитрий Константинович 1839–1921,Шульяченко Алексей Романович 1841–1903,Щукин Николай Леонидович 1848–1924,Яковкин Александр Александрович 1860–1936","1978"," Московский пр./Санкт-Петербург, д. 26/49 ",59.9183802,30.3182825,"мрамор",FALSE,"работал",1838-02-17,1906-10-18,"мужской пол","Q61313","5. Zastoi",1978
"41",41,2805531324,"Бекетову Н.Н.","Николай Николаевич Бекетов","В этом доме с 1892 по 1911 г. жил и работал выдающийся русский химик Николай Николаевич Бекетов","1955"," 8-я линия В.О./Санкт-Петербург, д. 17 ",59.9377776,30.2818191,"мрамор",FALSE,"жил и работал",1827-01-13,1911-12-13,"мужской пол","Q910206","4. Ottepel",1955
"42",42,2805530361,"Белавину А.Ф.",NA,"Рядовой Белавин Александр Федорович в ночь на 7 ноября 1941 года, обезвреживая авиабомбу, ценой своей жизни спас здание Почтамта от разрушения. Награжден орденом Ленина","1990"," Почтамтская ул./Санкт-Петербург, д. 9 ",59.9320674,30.3011706,"мрамор",FALSE,NA,NA,NA,NA,NA,"6. Perestroika",1990
"43",43,2805549572,"Белинскому В.Г.","Виссарион Григорьевич Белинский","В этом доме в 1842–1846 гг. жил Виссарион Григорьевич Белинский","1948"," Невский пр./Санкт-Петербург, д. 68/40 ",59.9333465,30.3450199,"мрамор",FALSE,"жил",1811-06-11,1848-06-07,"мужской пол","Q192885","3. Stalin time",1948
"44",44,2805549582,"Белову А.А.","Александр Александрович Белов","В этом доме последние 6 лет жил выдающийся спортсмен-баскетболист Александр Белов (1951–1978). За короткую жизнь он стал чемпионом страны, Европы, мира, Олимпийских игр","1994"," Зверинская ул./Санкт-Петербург, д. 38 ",59.952591,30.302707,"гранит",TRUE,"жил",1951-11-09,1978-10-03,"мужской пол","Q714318","7. Federation",1994
"45",45,2805526318,"Белышеву А.В.","Белышев, Александр Викторович","В этом доме с 1959 года по 1974 год жил Белышев Александр Викторович, член Коммунистической партии с марта 1917 года, председатель судового комитета и комиссар крейсера “Аврора”","1987"," Б. Пороховская ул./Санкт-Петербург, д. 33 ",59.953087,30.420488,"гранит",FALSE,"жил",1893-08-06,1974-08-29,"мужской пол","Q4083192","6. Perestroika",1987
