"","X","ID","Person","Name","Description","Year","Address","pl_latitude","pl_longitude","Material","Is_sculptor","what_did","BirthDate","DeathDate","Gender","Wiki","Pl_Period","Pl_y"
"444",444,2805528435,"Ленину В.И.","Владимир Ильич Ленин","В этом доме, в комнате сестер Невзоровых, в ноябре 1893 года В.И. Ленин выступал с докладом на собрании петербургских марксистов. С этого времени Ленин становится руководителем социал-демократического движения в России","1970"," 7-я линия В.О./Санкт-Петербург, д. 74 ",59.947458,30.273119,"гранит",FALSE,"выступал",1870-04-22,1924-01-21,"мужской пол","Q1394","5. Zastoi",1970
"445",445,2805528450,"Ленину В.И.","Владимир Ильич Ленин","В этом доме, в квартире Г.М. Кржижановского, в 1895 году под руководством В.И. Ленина проходили нелегальные собрания петербургских социал-демократов","1970"," Коломенская ул./Санкт-Петербург, д. 7 ",59.925618,30.353843,"гранит",FALSE,NA,1870-04-22,1924-01-21,"мужской пол","Q1394","5. Zastoi",1970
"446",446,2805527385,"Ленину В.И.","Владимир Ильич Ленин","Сооружена в память выступления на митинге рабочих Обуховского завода Великаго вождя мирового пролетариата Владимира Ильича Ленина в мае 1917 года. Вождю рабочих — рабочие зав. “Большевик” 23 апреля 1924 г.","1924"," Обуховской Обороны пр./Санкт-Петербург, д. 120 ",59.854462,30.4811287,"мрамор",FALSE,"создал",1870-04-22,1924-01-21,"мужской пол","Q1394","2. Early soviet",1924
"447",447,2805527421,"Ленину В.И.","Владимир Ильич Ленин","Везде, всегда безраздельно с нами Ленин. Пролетарии всех стран, соединяйтесь! 1917–1927","1927","Обводного канала наб., 223–225.",59.9099326,30.2720501,NA,FALSE,NA,1870-04-22,1924-01-21,"мужской пол","Q1394","2. Early soviet",1927
"448",448,2805527436,"Ленину В.И.","Владимир Ильич Ленин","1917. В стенах “Ямы” кипела революционная мысль рабочих Невской заставы. Здесь услышали они слово своего вождя Ленина. 1930.","1930"," Седова ул./Санкт-Петербург, д. 45 ",59.8860352,30.4229403,"мрамор",FALSE,NA,1870-04-22,1924-01-21,"мужской пол","Q1394","3. Stalin time",1930
"449",449,2805527457,"Ленину В.И.","Владимир Ильич Ленин","Общее собрание слушателей и командного состава Военно-морского училища 2 декабря 1922 года избрало первым почетным слушателем нашего училища вождя мирового пролетариата Владимира Ильича Ленина","1930-е"," Лейтенанта Шмидта наб./Санкт-Петербург, д. 17 ",59.935258,30.280413,"мрамор",FALSE,NA,1870-04-22,1924-01-21,"мужской пол","Q1394","3. Stalin time",1930
"450",450,2805527499,"Ленину В.И.","Владимир Ильич Ленин","Здесь, в помещении б. курсов П.Ф. Лесгафта, в период 1905–1907 годов неоднократно выступал и проводил занятия марксистского кружка Владимир Ильич Ленин.В 1917 году в этом же доме под председательством В.И. Ленина проходило одно из заседаний VII (Апрельской) Всероссийской конференции РСДРП (большевиков)","1940-е"," Английский пр./Санкт-Петербург, д. 32 ",59.9228454,30.285532,"гранит",FALSE,"преподавал",1870-04-22,1924-01-21,"мужской пол","Q1394","3. Stalin time",1940
"451",451,2805527582,"Ленину В.И.","Владимир Ильич Ленин","В этом доме, скрываясь от Временного правительства, с 10 (23) августа 1917 г. несколько дней жил и работал Владимир Ильич Ленин","1956"," Ильичево пос. ",60.2682097,29.7539118,"мрамор",FALSE,"жил и работал",1870-04-22,1924-01-21,"мужской пол","Q1394","4. Ottepel",1956
"452",452,2805527594,"Ленину В.И.","Владимир Ильич Ленин","Здесь, на чердаке сарая, скрываясь от преследования контрреволюционного Временного правительства, с 10 (23) июля 1917 года несколько дней жил и работал Владимир Ильич Ленин","1956","Сестрорецк, пос. Разлив, ул. Емельянова, д. 3.",60.079744,29.9766034,"мрамор",FALSE,"жил и работал",1870-04-22,1924-01-21,"мужской пол","Q1394","4. Ottepel",1956
"453",453,2805527707,"Ленину В.И.","Владимир Ильич Ленин","Здесь на митинге рабочих в июне 1917 года выступал В.И. Ленин с докладом о международном положении и задачах русской революции","1957"," Московский пр./Санкт-Петербург, д. 115 ",59.888323,30.318658,"мрамор",TRUE,"выступал",1870-04-22,1924-01-21,"мужской пол","Q1394","4. Ottepel",1957
"454",454,2805527718,"Ленину В.И.","Владимир Ильич Ленин","В ночь с 28 на 29 октября (с 10 на 11 ноября по новому стилю) 1917 года Владимир Ильич Ленин приехал на завод, чтобы лично проверить выполнение задания путиловскими рабочими, данного им утром 28 октября (10 ноября по новому стилю) о срочном изготовлении боевого оружия для фронта","1957"," Стачек пр./Санкт-Петербург, д. 47 ",59.8808948,30.2607868,"мрамор",FALSE,"работал",1870-04-22,1924-01-21,"мужской пол","Q1394","4. Ottepel",1957
"455",455,2805527729,"Ленину В.И.","Владимир Ильич Ленин","В декабре 1894 года на Кировский завод (бывш. Путиловский) приезжал Владимир Ильич Ленин с целью ознакомления с жизнью и работой трудящихся крупнейшего предприятия страны. 12 (25 по новому стилю) мая 1917 года Владимир Ильич Ленин выступал на 20-тысячном митинге рабочих Путиловского завода и Путиловской судоверфи с докладом по текущему моменту","1957"," Стачек пр./Санкт-Петербург, д. 47 ",59.8808948,30.2607868,"мрамор",FALSE,"работал",1870-04-22,1924-01-21,"мужской пол","Q1394","4. Ottepel",1957
"456",456,2805527743,"Ленину В.И.","Владимир Ильич Ленин","25 (12) мая 1917 года здесь, на многотысячном митинге рабочих и работниц бывшего Путиловского (ныне Кировского) завода, выступил с речью о задачах пролетариата и революции величайший гений человечества, вождь мирового пролетариата Владимир Ильич Ленин. В дни обороны Петрограда от белогвардейских банд Краснова—Керенского в ночь с 28 на 29 октября (с 10 на 11 ноября) 1917 г. Владимир Ильич Ленин посетил Путиловский завод","1957"," Стачек пр./Санкт-Петербург, д. 47 ",59.8808948,30.2607868,"бронза",FALSE,"работал",1870-04-22,1924-01-21,"мужской пол","Q1394","4. Ottepel",1957
"457",457,2805527754,"Ленину В.И.","Владимир Ильич Ленин","Здесь 25 (12) мая 1917 г. выступал на митинге петроградских рабочих Владимир Ильич Ленин","1957"," Фонтанки р. наб./Санкт-Петербург, д. 203 ",59.9185937,30.2741914,"мрамор",FALSE,"выступал",1870-04-22,1924-01-21,"мужской пол","Q1394","4. Ottepel",1957
"458",458,2805527764,"Ленину В.И.","Владимир Ильич Ленин","В этом доме в феврале 1897 г. у своей матери М.А. Ульяновой останавливался Владимир Ильич Ленин перед ссылкой в село Шушенское","1957"," Чайковского ул./Санкт-Петербург, д. 13 ",59.9464094,30.3463306,"гранит",FALSE,"остановился",1870-04-22,1924-01-21,"мужской пол","Q1394","4. Ottepel",1957
"459",459,2805527903,"Ленину В.И.","Владимир Ильич Ленин","В этом доме после июльских событий с 7 (20) по 9 (22) июля 1917 г. скрывался от преследования контрреволюционного буржуазного Временного правительства Владимир Ильич Ленин","1958"," 10-я Советская ул./Санкт-Петербург, д. 17, лит. А ",59.936143,30.3814141,"гранит",TRUE,"скрывался",1870-04-22,1924-01-21,"мужской пол","Q1394","4. Ottepel",1958
"460",460,2805527915,"Ленину В.И.","Владимир Ильич Ленин","Здесь, в квартире Д.В. Стасова, в 1917 году неоднократно бывал Владимир Ильич Ленин","1959"," Фурштатская ул./Санкт-Петербург, д. 20 ",59.9454579,30.3542454,"мрамор",TRUE,"бывал",1870-04-22,1924-01-21,"мужской пол","Q1394","4. Ottepel",1959
"461",461,2805528006,"Ленину В.И.","Владимир Ильич Ленин","В этом доме с 4 (17) апреля по 5 (18) июля 1917 года жил вождь международного пролетариата, создатель большевистской партии и первого в мире Советского социалистического государства Владимир Ильич Ленин","1960"," Ленина ул./Санкт-Петербург, д. 52 ",59.9656835,30.2949623,"мрамор",TRUE,"жил",1870-04-22,1924-01-21,"мужской пол","Q1394","4. Ottepel",1960
"462",462,2805528048,"Ленину В.И.","Владимир Ильич Ленин","Здесь, в комнате рабочего Обуховского завода В.А. Шелгунова, в 1894–1895 гг. В.И. Ленин проводил занятия в марксистском кружке и собрания передовых рабочих Петербурга","1960","Новоалександровская ул./Санкт-Петербург, д. 23",59.865712,30.460057,"гранит",FALSE,"работал",1870-04-22,1924-01-21,"мужской пол","Q1394","4. Ottepel",1960
"463",463,2805528058,"Ленину В.И.","Владимир Ильич Ленин","В этом доме накануне Октябрьской социалистической революции с 7 (20) октября по 24 октября (6 ноября) 1917 года скрывался от преследования контрреволюционного буржуазного Временного правительства Владимир Ильич Ленин. Отсюда он руководил подготовкой вооруженного восстания","1960"," Сердобольская ул./Санкт-Петербург, д. 1/92 ",59.9948888,30.3290548,"гранит",FALSE,"руководил",1870-04-22,1924-01-21,"мужской пол","Q1394","4. Ottepel",1960
"464",464,2805528068,"Ленину В.И.","Владимир Ильич Ленин","В этой комнате Смольного с середины ноября 1917 года по 10 марта 1918 года жил В.И. Ленин","1960","Санкт–Петербург, Полюстровский пр.59",59.972431,30.381991,NA,FALSE,"жил",1870-04-22,1924-01-21,"мужской пол","Q1394","4. Ottepel",1960
"465",465,2805528076,"Ленину В.И.","Владимир Ильич Ленин","В этой комнате после образования Советского правительства на Втором Всероссийском съезде Советов был первый кабинет Председателя Совета Народных Комиссаров Владимира Ильича Ленина. Здесь В.И. Ленин подписал первые декреты и распоряжения Советского правительства, проводил заседания Совнаркома, встречался с рабочими, крестьянами, солдатами, делегатами Второго Всероссийского съезда Советов","1960","Санкт–Петербург, Полюстровский пр.59",59.972431,30.381991,"мрамор",FALSE,"работал",1870-04-22,1924-01-21,"мужской пол","Q1394","4. Ottepel",1960
"466",466,2805528085,"Ленину В.И.","Владимир Ильич Ленин","Здесь, в Актовом зале Дворца Труда, в марте 1919 года В.И. Ленин принял участие в работе Первого съезда сельскохозяйственных рабочих Петроградской губернии и выступал с речью об организации профессионального союза сельскохозяйственных рабочих","1960"," Труда пл./Санкт-Петербург, д. 4 ",59.93241,30.2928269,"мрамор",TRUE,"выступал",1870-04-22,1924-01-21,"мужской пол","Q1394","4. Ottepel",1960
"467",467,2805528110,"Ленину В.И.","Владимир Ильич Ленин","Здесь, в Актовом зале Дворца Труда, в марте 1919 г. В.И. Ленин принял участие в работе Первого съезда сельскохозяйственных рабочих Петроградской губернии и выступал с речью об организации профессионального союза сельскохозяйственных рабочих","1963"," Труда пл./Санкт-Петербург, д. 4 ",59.93241,30.2928269,"мрамор",FALSE,"выступал",1870-04-22,1924-01-21,"мужской пол","Q1394","4. Ottepel",1963
"468",468,2805528123,"Ленину В.И.","Владимир Ильич Ленин","В этом доме с 31 августа до начала октября 1893 года жил Владимир Ильич Ленин. С этого времени началась его деятельность в Петербурге по созданию революционной марксистской партии России","1963"," Чайковского ул./Санкт-Петербург, д. 58 ",59.9465945,30.3659465,"гранит",FALSE,"основал",1870-04-22,1924-01-21,"мужской пол","Q1394","4. Ottepel",1963
"469",469,2805528192,"Ленину В.И.","Владимир Ильич Ленин","Здесь, у озера Разлив, в июле-августе 1917 года Владимир Ильич Ленин скрывался от преследования контрреволюционного буржуазного Временного правительства. Отсюда В.И. Ленин руководил большевистской партией, готовил ее к вооруженному восстанию","1964","Сестрорецк, пос. Тарховка, Дорога к Шалашу Ленина, д. 3, литер А",60.0816329,30.0312168,"металл",FALSE,"руководил",1870-04-22,1924-01-21,"мужской пол","Q1394","4. Ottepel",1964
"470",470,2805528282,"Ленину В.И.","Владимир Ильич Ленин","В этом доме 9 (22) мая 1906 г. В.И. Ленин выступил на народном митинге с речью о тактике РСДРП по отношению к Государственной думе. Собрание приняло резолюцию, предложенную В.И. Лениным","1965"," Тамбовская ул./Санкт-Петербург, д. 63/10 ",59.9093005,30.3515104,"гранит",FALSE,"выступал",1870-04-22,1924-01-21,"мужской пол","Q1394","5. Zastoi",1965
"471",471,2805528292,"Ленину В.И.","Владимир Ильич Ленин","В этом доме, в квартире № 9, в ночь с 25 на 26 октября (7–8 ноября) 1917 г. В.И. Ленин написал Декрет о земле, который был принят Вторым Всероссийским Съездом Советов","1965"," Херсонская ул./Санкт-Петербург, д. 5 ",59.9296185,30.3768869,"гранит",FALSE,NA,1870-04-22,1924-01-21,"мужской пол","Q1394","5. Zastoi",1965
"472",472,2805528302,"Ленину В.И.","Владимир Ильич Ленин","В этом доме, в квартире М.И. Калинина, в октябре 1917 г. В.И. Ленин проводил партийные совещания о подготовке вооруженного восстания","1965"," Энгельса пр./Санкт-Петербург, д. 92 ",60.023698,30.318504,"гранит",FALSE,"участвовал в совещании",1870-04-22,1924-01-21,"мужской пол","Q1394","5. Zastoi",1965
"473",473,2805528393,"Ленину В.И.","Владимир Ильич Ленин","В этом доме, в квартире рабочего Д.И. Павлова, в октябре 1917 года состоялась встреча В.И. Ленина с работниками Военной организации при ЦК РСДРП (б) Н.И. Подвойским, В.А. Антоновым (Овсеенко) и В.И. Невским. Обсуждались вопросы готовности к вооруженному восстанию","1967"," Сердобольская ул./Санкт-Петербург, д. 35 ",59.989681,30.3168079,"мрамор",FALSE,"встретился",1870-04-22,1924-01-21,"мужской пол","Q1394","5. Zastoi",1967
"474",474,2805528424,"Ленину В.И.","Владимир Ильич Ленин","В этом доме, в бывшем рабочем клубе, в июне 1906 года выступал В.И. Ленин на собрании социал-демократической организации Балтийского завода","1969"," Большой пр. В. О./Санкт-Петербург, д. 82 ",59.9299689,30.2523573,"гранит",FALSE,"работал",1870-04-22,1924-01-21,"мужской пол","Q1394","5. Zastoi",1969
"475",475,2805528504,"Ленину В.И.","Владимир Ильич Ленин","Улица Ленина. На этой улице в доме 52/9 с 4 (17) апреля по 5 (18) июля 1917 года жил и работал Владимир Ильич Ленин, основатель большевистской партии, вождь Великого Октября, создатель первого в мире социалистического государства","1970"," Ленина ул./Санкт-Петербург, д. 1/31 ",59.9583029,30.3113017,"гранит",TRUE,"жил и работал",1870-04-22,1924-01-21,"мужской пол","Q1394","5. Zastoi",1970
"476",476,2805528618,"Ленину В.И.","Владимир Ильич Ленин","В этом здании на съезде крестьянских депутатов В.И. Ленин выступил 14 ноября 1917 года с речью по аграрному вопросу. 18 ноября — о мерах, принятых Советским правительством против Ставки Верховного главнокомандующего, отказавшегося вести переговоры о мире. Съезд поддержал мероприятия Советского правительства","1970"," Фонтанки р. наб./Санкт-Петербург, д. 6 ",59.9458385,30.3383647,"гранит",FALSE,"выступал",1870-04-22,1924-01-21,"мужской пол","Q1394","5. Zastoi",1970
"477",477,2805528629,"Ленину В.И.","Владимир Ильич Ленин","В этом доме 9 августа 1917 г. находился В.И. Ленин, скрываясь от преследований Временного правительства","1970"," Ярославский пр./Санкт-Петербург, д. 11 ",60.0104301,30.3226052,"гранит",FALSE,"скрывался",1870-04-22,1924-01-21,"мужской пол","Q1394","5. Zastoi",1970
"478",478,2805528773,"Ленину В.И.","Владимир Ильич Ленин","В мае 1917 года Владимир Ильич Ленин встретился с Л.Б. Красиным и осмотрел электростанцию, помещавшуюся в этом здании","1989"," Малая ул./Пушкин г., д. 9 ",59.7196159,30.3995576,"гранит",FALSE,"встретился",1870-04-22,1924-01-21,"мужской пол","Q1394","6. Perestroika",1989
"479",479,2805528795,"Ленину В.И.","Владимир Ильич Ленин","В этом доме, в квартире члена ЦК РСДРП П.П. Румянцева, в ноябре 1905 года в течение двух недель нелегально жил и работал В.И. Ленин","1990"," 10-я Советская ул./Санкт-Петербург, д. 1/41 ",59.9373483,30.3779609,"гранит",FALSE,"жил и работал",1870-04-22,1924-01-21,"мужской пол","Q1394","6. Perestroika",1990
"480",480,2805528962,"Леонову А.П.","Леонид Александрович Полонский","А.П. Леонов род. в 1888 г. в с. Казимки, Тульской губ. С 17 лет начинает революционную деятельность в Москве в Миусском трампарке. В 1905 г. за революцион. деятельность высылается из Москвы. В 1915 г. тов. Леонов — член бюро Петербургского Комитета РСДРП (б), активно ведет революционную работу по всем трампаркам г. Петрограда. После Февральской революции — первый председатель Рабочего Комитета и организатор кол-ва В.О. трампарка. В 1918 г. участвовал на Южном фронте. В 1919 г. — особый уполномоч. комитета обороны г. Петрограда, участвовал в боях. 22 июня 1919 г. при отражении атаки юденических банд пал смертью храбрых","1929"," Средний пр./Санкт-Петербург, д. 77 ",59.9386274,30.2615134,"мрамор",FALSE,"руководил",1833-01-01,1913-01-01,"мужской пол","Q4370651","3. Stalin time",1929
"481",481,2805552935,"Лермонтову М.Ю.",NA,"Здесь, в лейб-гвардии гусарском полку, с 1834 по 1837 гг. и с 1838 по 1840 гг. служил великий русский поэт Михаил Юрьевич Лермонтов","1991"," Кадетский бульв./Пушкин г., д. 1 ",59.709289,30.4022231,"гранит",FALSE,"жил",NA,NA,NA,NA,"6. Perestroika",1991
"482",482,2805552916,"Лермонтову М.Ю.",NA,"В этом доме жил Михаил Юрьевич Лермонтов в 1836–1837 гг. Здесь им написано стихотворение “Смерть поэта”","1962"," Садовая ул./Санкт-Петербург, д. 61 ",59.9225,30.30641,"гранит",TRUE,"жил",NA,NA,NA,NA,"4. Ottepel",1962
