"","X","ID","Person","Name","Description","Year","Address","pl_latitude","pl_longitude","Material","Is_sculptor","what_did","BirthDate","DeathDate","Gender","Wiki","Pl_Period","Pl_y"
"682",682,2805547591,"Рождественскому Д.С.","Рождественский, Дмитрий Сергеевич","В этом здании с 1916 по 1940 гг. жил и работал выдающийся советский физик, организатор и первый директор Государственного оптического института, академик Дмитрий Сергеевич Рождественский","1968"," Биржевая линия/Санкт-Петербург, д. 14 ",59.9444218,30.2951674,"мрамор",FALSE,"жил и работал",1876-04-07,1940-06-25,"мужской пол","Q4396191","5. Zastoi",1968
"683",683,2805547611,"Розингу Б.Л.","Борис Львович Розинг","Здесь в 1907 г. впервые получил изображение на экране электронно-лучевой трубки Б.Л. Розинг","1978"," Московский пр./Санкт-Петербург, д. 26/49 ",59.9183802,30.3182825,"мрамор",FALSE,NA,1869-05-05,1933-04-20,"мужской пол","Q276286","5. Zastoi",1978
"684",684,2805547621,"Романкову П.Г.","Пётр Григорьевич Романков","Здесь в период с 1936 г. по 1990 г. работал выдающийся химик-технолог, член-корреспондент АН СССР, профессор Петр Григорьевич Романков","1991"," Московский пр./Санкт-Петербург, д. 26/49 ",59.9183802,30.3182825,"мрамор",FALSE,"работал",1904-01-17,1990-11-01,"мужской пол","Q216800","6. Perestroika",1991
"685",685,2805554433,"Рубинштейну А.Г.","Антон Григорьевич Рубинштейн","В создании этой гимназии личными средствами участвовал великий пианист и композитор Антон Григорьевич Рубинштейн. 16 (28) XI 1829 — 8 (20) XI 1894, Почетный гражданин Петергофа","1997"," Санкт-Петербургский пр./Петергоф г., д. 43 ",59.8845003,29.8851757,"мрамор",FALSE,"основал",1829-11-28,1894-11-20,"мужской пол","Q87567","7. Federation",1997
"686",686,2805554423,"Рубинштейну А.Г.","Антон Григорьевич Рубинштейн","В этом доме с 1887 г. по 1891 г. жил композитор и пианист, основатель Ленинградской Консерватории Антон Григорьевич Рубинштейн","1955"," Рубинштейна ул./Санкт-Петербург, д. 38 ",59.927122,30.343615,"мрамор",FALSE,"основал",1829-11-28,1894-11-20,"мужской пол","Q87567","4. Ottepel",1955
"687",687,2805554442,"Рудакову К.И.","Рудаков, Константин Иванович","В этом доме с 1934 по 1949 год жил советский художник Константин Иванович Рудаков","1972"," Б. Пушкарская ул./Санкт-Петербург, д. 50 ",59.962552,30.308574,"мрамор",FALSE,"жил",1891-03-26,1949-01-01,"мужской пол","Q4399299","5. Zastoi",1972
"688",688,2805554472,"Рудневу Л.В.",NA,"Памятник Борцам Революции сооружен в 1917–1919 годах. Архитектор Л.В. Руднев. На плитах текст А.В.Луначарского выполнен по рисунку художника В.М. Конашевича. Планировка Марсова поля осуществлена по проекту архитектора И.А. Фомина. Памятник охраняется государством","1987"," Марсово поле/Санкт-Петербург ",59.9440512,30.3318224,"бронза",FALSE,"создал",NA,NA,NA,NA,"6. Perestroika",1987
"689",689,2805554452,"Рудневу Л.В.",NA,"Лев Владимирович Руднев, выдающийся советский архитектор, жил и работал в этом доме с 1924 года по 1942 год","1989"," Кирочная ул./Санкт-Петербург, д. 17 ",59.9437025,30.3587686,"гранит",FALSE,"жил и работал",NA,NA,NA,NA,"6. Perestroika",1989
"690",690,2805529159,"Русакову И.В.","Русаков, Иван Васильевич","Здесь в 1921 году руководил госпиталем активный участник революционного движения, один из первых организаторов советского здравоохранения, делегат Х съезда РКП (б), член партии с 1905 года, врач Иван Васильевич Русаков. Погиб 20 марта 1921 года от руки врагов революции","1969"," Мануильского ул./Кронштадт г., д. 2 ",59.991694,29.7927309,"мрамор",FALSE,"умер",1877-10-07,1921-03-18,"мужской пол","Q4400217","5. Zastoi",1969
"691",691,2805547631,"Русакову М.П.",NA,"В этом доме жил с 1920 года по 1962 год выдающийся советский геолог, первооткрыватель многих месторождений полезных ископаемых в Советском Союзе Михаил Петрович Русаков","1982"," 20-я линия В.О./Санкт-Петербург, д. 13 ",59.9329499,30.266987,"латунь",FALSE,"жил",NA,NA,NA,NA,"5. Zastoi",1982
"692",692,2805547643,"Рыбкину П.Н.","Рыбкин, Пётр Николаевич","В этом доме жил соратник изобретателя радио А.С. Попова Петр Николаевич Рыбкин. 1864–1948","1948"," Зосимова ул./Кронштадт г., д. 22, корп. 2 ",59.997315,29.7597609,"мрамор",FALSE,"жил",1864-05-26,1948-01-10,"мужской пол","Q4401587","3. Stalin time",1948
"693",693,2805525937,"Рылееву К.Ф.","Кондратий Фёдорович Рылеев","В этом доме в 1824–1825 годах жил декабрист Кондратий Федорович Рылеев","1975"," Мойки р. наб./Санкт-Петербург, д. 72 ",59.9307997,30.3070357,"гранит",FALSE,"жил",1795-09-29,1826-07-25,"мужской пол","Q49509","5. Zastoi",1975
"694",694,2805554484,"Рылову А.А.","Аркадий Александрович Рылов","В этом доме с 1929 по 1939 год жил заслуженный деятель искусств РСФСР, художник Аркадий Александрович Рылов","1985"," Б. Конюшенная ул./Санкт-Петербург, д. 19 ",59.9387942,30.3230833,"гранит",TRUE,"жил",1870-01-29,1939-06-22,"мужской пол","Q3623704","6. Perestroika",1985
"695",695,2805554503,"Савиной М.Г.","Мария Гавриловна Савина","В этом доме с 1908 г. жила и в 1915 г. умерла артистка Мария Гавриловна Савина","1957"," Литераторов ул./Санкт-Петербург, д. 17 ",59.969405,30.311816,"мрамор",FALSE,"умер",1854-04-11,1915-09-21,"женский пол","Q4403935","4. Ottepel",1957
"696",696,2805554515,"Савиной М.Г.","Мария Гавриловна Савина","Дом этот заложен и построен в 1900–1902 гг. трудами, заботой и большой любовью к актеру великой русской артистки, основательницы Театрального Общества Марии Гавриловны Савиной","1958"," Петровский пр./Санкт-Петербург, д. 13 ",59.96253,30.254594,"мрамор",FALSE,"основал",1854-04-11,1915-09-21,"женский пол","Q4403935","4. Ottepel",1958
"697",697,2805554527,"Савиной М.Г.","Мария Гавриловна Савина","Убежище для престарелых артистов не богадельня, а дом отдыха до конца жизни для художников сцены, которые за право этого отдыха заплатили вперед, отдав все силы, все нервы и здоровье на служение искусству. В этом убежище они должны найти покой, наивозможный комфорт и нежное, бережное отношение за свои труды. М. Савина","1958"," Петровский пр./Санкт-Петербург, д. 13 ",59.96253,30.254594,"мрамор",FALSE,NA,1854-04-11,1915-09-21,"женский пол","Q4403935","4. Ottepel",1958
"698",698,2805554553,"Салтыкову-Щедрину М.Е.","Михаил Евграфович Салтыков-Щедрин","В этом доме с 1876 г. жил и в 1889 г. умер Михаил Евграфович Салтыков-Щедрин","1955"," Литейный пр./Санкт-Петербург, д. 60 ",59.933816,30.3483481,"мрамор",FALSE,"умер",1826-01-27,1889-05-10,"мужской пол","Q211785","4. Ottepel",1955
"699",699,2805529168,"Самойловой К.Н.",NA,"Самойлова Конкордия Николаевна, 1876 года рождения, член КПСС с 1903 года. Профессиональная революционерка. В 1917 году вела активную революционную работу среди женщин Петрограда, в годы Гражданской войны — большую политическую работу на Волге, Украине, Урале. Умерла в 1921 году","1957"," Самойловой ул./Санкт-Петербург, д. 2 ",59.897907,30.368838,"мрамор",FALSE,"умер",NA,NA,NA,NA,"4. Ottepel",1957
"700",700,2805554563,"Самойлову В.В.","Вера Васильевна Самойлова","В этом доме жил и 28 марта 1887 г. скончался драматический артист Василий Васильевич Самойлов","1950"," Стремянная ул./Санкт-Петербург, д. 8 ",59.9311973,30.3506727,"мрамор",FALSE,"умер",1824-12-04,1880-12-02,"женский пол","Q4406727","3. Stalin time",1950
"701",701,2805554572,"Самойлову П.В.","Самойлов, Павел Васильевич","В этом доме с 1898 года жил и в 1931 году умер заслуженный артист РСФСР Павел Васильевич Самойлов","1956"," Аптекарский пер./Санкт-Петербург, д. 6 ",59.9424872,30.3282174,"мрамор",FALSE,"умер",1866-07-23,1931-04-16,"мужской пол","Q4406715","4. Ottepel",1956
"702",702,2805554582,"Саянову В.М.","Саянов, Виссарион Михайлович","В этом доме с 1934 по 1959 г. жил писатель Виссарион Михайлович Саянов","1960"," Чебоксарский пер./Санкт-Петербург, д. 2/9 ",59.937771,30.3266131,"мрамор",FALSE,"жил",1903-06-16,1959-01-22,"мужской пол","Q4409624","4. Ottepel",1960
"703",703,2805529178,"Свердлову Я.М.и Крупской Н.К.","Гаухман-Свердлов, Марксэн Яковлевич","Здесь в апреле-июне 1917 года работали Я.М. Свердлов и Н.К. Крупская","1960-е"," Куйбышева ул./Санкт-Петербург, д. 4 ",59.954728,30.325608,"мрамор",FALSE,"работал",1929-06-30,1997-05-03,"мужской пол","Q4134252","4. Ottepel",1960
"704",704,2805529190,"Свердлову Я.М.","Гаухман-Свердлов, Марксэн Яковлевич","В этом доме с сентября 1917 г. по январь 1918 г. жил один из выдающихся организаторов и строителей Коммунистической партии и Советского государства Яков Михайлович Свердлов","1962"," Фурштатская ул./Санкт-Петербург, д. 27 ",59.9449704,30.3581652,"гранит",FALSE,"жил",1929-06-30,1997-05-03,"мужской пол","Q4134252","4. Ottepel",1962
"705",705,2805529200,"Семашко Н.А.",NA,"Семашко Николай Александрович. 1874–1949. Первый народный комиссар здравоохранения РСФСР. В 1923 г. Кронштадтскому военно-морскому госпиталю присвоено имя Н.А. Семашко",NA," Мануильского ул./Кронштадт г., д. 2 ",59.991694,29.7927309,NA,FALSE,"название в честь",NA,NA,NA,NA,"Unknown period",NA
"706",706,2805547659,"Семенову Н.Н.",NA,"Здесь работал с 1921 по 1938 год академик Семенов Николай Николаевич (1896–1986), лауреат Нобелевской премии, дважды Герой Социалистического Труда","1994"," Политехническая ул./Санкт-Петербург, д. 29 ",60.0077249,30.3732928,"гранит",FALSE,"работал",NA,NA,NA,NA,"7. Federation",1994
"707",707,2805547670,"Семенову-Тян-Шанскому П.П.",NA,"В этом доме с 1863 года жил и в 1914 году умер Петр Петрович Семенов-Тян-Шанский","1927"," 8-я линия В.О./Санкт-Петербург, д. 39 ",59.941413,30.2776025,"мрамор",TRUE,"умер",NA,NA,NA,NA,"2. Early soviet",1927
"708",708,2805554592,"Сергееву К.М.","Сергеев, Константин Михайлович","1910–1992. В этом доме с 1951 жил великий танцовщик и балетмейстер, первый президент Академии русского балета Константин Михайлович Сергеев","1994"," Каменноостровский пр./Санкт-Петербург, д. 2 ",59.957176,30.3195211,"гранит",TRUE,"жил",1910-03-05,1992-04-01,"мужской пол","Q1352511","7. Federation",1994
"709",709,2805554619,"Серебрякову П.А.","Серебряков, Павел Алексеевич","Здесь с 1939 по 1977 год жил народный артист СССР Павел Алексеевич Серебряков","1984"," Бородинская ул./Санкт-Петербург, д. 13 ",59.9242612,30.3338021,"мрамор",FALSE,"жил",1909-03-13,1977-08-17,"мужской пол","Q4417338","5. Zastoi",1984
"710",710,2805554639,"Серову А.Н.","Александр Николаевич Серов","Композитор Александр Николаевич Серов род. в С.П.Б. 11 Января 1820 г. † в этом доме 20 Января 1871 г. От Музыкально-исторического о-ва имени графа А.Д. Шереметева","1910-е"," 15-я линия В.О./Санкт-Петербург, д. 8 ",59.9355778,30.2734439,"мрамор",FALSE,"название в честь",1820-01-23,1871-02-01,"мужской пол","Q442978","1. Empire",1910
"711",711,2805547690,"Сеченову И.М.",NA,"Здесь работал с 1860 года по 1870 год основоположник отечественной физиологии и экспериментальной психологии, выдающийся ученый и общественный деятель Иван Михайлович Сеченов","1979"," Пироговская наб./Санкт-Петербург, д. 3 ",59.954614,30.3467261,"мрамор",FALSE,"работал",NA,NA,NA,NA,"5. Zastoi",1979
"712",712,2805547709,"Сеченову И.М.",NA,"В этой аудитории 3 (15) ноября 1863 года в публичной лекции, прочитанной в пользу нуждающихся студентов Медико-хирургической академии, И.М. Сеченов впервые изложил содержание будущей книги “Рефлексы головного мозга”","1981"," Пироговская наб./Санкт-Петербург, д. 1 ",59.9541853,30.3490513,"мрамор",FALSE,"жил",NA,NA,NA,NA,"5. Zastoi",1981
"713",713,2805554666,"Симонову Н.К.","Николай Константинович Симонов","В этом доме с 1946 по 1973 год жил выдающийся советский артист, Герой Социалистического Труда, народный артист СССР Николай Константинович Симонов","1976"," Гагаринская ул./Санкт-Петербург, д. 11 ",59.9461106,30.3423794,"бронза",TRUE,"жил",1901-12-04,1973-04-20,"мужской пол","Q26184","5. Zastoi",1976
"714",714,2805554689,"Скоробогатову К.В.","Константин Васильевич Скоробогатов","В этом доме с 1951 по 1969 год жил народный артист СССР, лауреат Государственных премий Константин Васильевич Скоробогатов","1973"," Дворцовая наб./Санкт-Петербург, д. 14 ",59.9444965,30.3230758,"гранит",FALSE,"жил",1887-03-06,1969-07-28,"мужской пол","Q4422288","5. Zastoi",1973
"715",715,2805529209,"Скороходову А.К.",NA,"Трамвайный парк имени Александра Касторовича Скороходова. Рабочий-слесарь. Партийные имена Кастрыч и т. Алексей. Род. в 1882 г., из крестьян Костромской губ., член Р.К.П. (б.) с 1912 г. В 1917–1918 гг. — председатель районного Совета и районного комитета Р.К.П. (б.) на Петроградской стороне в Ленинграде. Расстрелян белыми в Харькове летом 1919 г. на партийном посту","1929"," Барочная ул./Санкт-Петербург, д. 12 ",59.9699301,30.2869242,"мрамор",FALSE,"название в честь",NA,NA,NA,NA,"3. Stalin time",1929
"716",716,2805547720,"Скочинскому А.А.",NA,"Здесь в 1895–1930 гг. учился и работал крупнейший ученый, основоположник рудничной аэрологии, академик Александр Александрович Скочинский","1961"," Лейтенанта Шмидта наб./Санкт-Петербург, д. 45 ",59.929451,30.268748,"мрамор",TRUE,"учился",NA,NA,NA,NA,"4. Ottepel",1961
"717",717,2805554718,"Смирдину А.Ф.","Александр Филиппович Смирдин","В этом доме в 1830-х годах находились библиотека и книжная лавка известного книгоиздателя Александра Филлиповича Смирдина. Здесь встречались А.С. Пушкин, И.А. Крылов, В.А. Жуковский, Н.В. Гоголь и другие русские писатели и поэты","1997"," Невский пр./Санкт-Петербург, д. 22 ",59.9360427,30.3229521,NA,FALSE,"встретился",1795-02-01,1857-09-28,"мужской пол","Q4424524","7. Federation",1997
"718",718,2805529231,"Смирнову В.С.","Смирнов, Владимир Степанович","Трамвайный парк имени Василия Сергеевича Смирнова. Член Р.К.П. (б.) 1917 г., крестьянин Тверской губ. Поступил на Г.Ж.Д. кондуктором 1/8 1912 г. Заведывающий службой движения. Член Совета Управления Г.Ж.Д. Мобилизован на Южный фронт. Председатель коммунистической ячейки при продовольственной комиссии 9-й дивизии 13 армии. Умер от сыпного тифа в г. Таганроге 27/2 1920 г.","1929-1930"," Дегтярный пер./Санкт-Петербург, д. 3 ",59.9392193,30.3809325,"мрамор",FALSE,"название в честь",1895-01-01,1918-01-01,"мужской пол","Q4424647","3. Stalin time",1930
"719",719,2805547731,"Смоленскому Г.А.","Смоленский, Георгий Анатольевич","В этом здании с 1972 года по 1980 год работал видный советский физик, член-корреспондент АН СССР Георгий Анатольевич Смоленский","1990"," Заповедная ул./Санкт-Петербург, д. 51 ",60.0462248,30.2529795,"мрамор",FALSE,"работал",1910-06-23,1986-11-20,"мужской пол","Q4424966","6. Perestroika",1990
"720",720,2805547742,"Смоленскому Г.А.","Смоленский, Георгий Анатольевич","В этом доме с 1974 года по 1980 год жил видный советский физик, член-корреспондент АН СССР Георгий Анатольевич Смоленский","1990"," Энгельса пр./Санкт-Петербург, д. 63, корп. 3 ",60.019593,30.326359,"гранит",FALSE,"жил",1910-06-23,1986-11-20,"мужской пол","Q4424966","6. Perestroika",1990
"721",721,2805529246,"Смородину П.И.",NA,"В этом доме с 1929 по 1933 год жил один из организаторов комсомола, Первый секретарь ЦК РКСМ в 1921–1924 годах, видный партийный деятель Петр Иванович Смородин","1988"," Большой пр. В. О./Санкт-Петербург, д. 57 ",59.9358439,30.2698075,"гранит",TRUE,"жил",NA,NA,NA,NA,"6. Perestroika",1988
"722",722,2805554779,"Собинову Л.В.",NA,"В этом доме с 1915 г. по 1929 г. жил великий русский певец Леонид Витальевич Собинов","1959"," Чайковского ул./Санкт-Петербург, д. 8 ",59.9468044,30.3442634,"мрамор",TRUE,"жил",NA,NA,NA,NA,"4. Ottepel",1959
"723",723,2805547757,"Соболевскому П.Г.","Соболевский, Пётр Григорьевич","Здесь с 1824 по 1841 год работал крупнейший металлург, член-корреспондент Академии наук Петр Григорьевич Соболевский","1974"," 21-я линия В.О./Санкт-Петербург, д. 2 ",59.930121,30.2688549,"мрамор",FALSE,"работал",1782-02-15,1841-10-24,"мужской пол","Q19117360","5. Zastoi",1974
"724",724,2805554801,"Соболеву Л.С.","Сергей Львович Соболев","В этом доме с 1924 по 1971 год жил и работал писатель Леонид Сергеевич Соболев","1976"," Шпалерная ул./Санкт-Петербург, д. 30 ",59.9492058,30.3539209,"гранит",FALSE,"жил и работал",1908-10-06,1989-01-03,"мужской пол","Q323337","5. Zastoi",1976
"725",725,2805554814,"Сокову В.А.",NA,"В этом доме с 1936 по 1942 гг. жил основоположник отечественной шашечной школы Василий Александрович Соков. Погиб в боях под Нарвой","1992"," Моховая ул./Санкт-Петербург, д. 32 ",59.9409045,30.3454485,"гранит",FALSE,"умер",NA,NA,NA,NA,"7. Federation",1992
"726",726,2805529272,"Соколовой  Е.","Евгения Соколова","Соколова Евгения (1901–1920) — дочь петроградского рабочего. В 17 лет — член большевистской партии, ведет большую общественно-политическую работу в типографии. В 1920 году бесстрашная разведчица, выполняя задание командования Красной Армии на Польском фронте, была схвачена и замучена белополяками. В 1922 г. типографии бывшего Товарищества издательского и печатного дела А.Ф. Маркса по просьбе трудящихся было присвоено имя Евгении Соколовой","1960-е"," Измайловский пр./Санкт-Петербург, д. 2 ",59.9180421,30.307992,"мрамор",FALSE,"название в честь",1901-01-01,1920-01-01,"женский пол","Q30345588","4. Ottepel",1960
