"","X","ID","Person","Name","Description","Year","Address","pl_latitude","pl_longitude","Material","Is_sculptor","what_did","BirthDate","DeathDate","Gender","Wiki","Pl_Period","Pl_y"
"231",231,2805544920,"Заварзину А.А.",NA,"В этом доме с 1932 по 1941 год работал академик Алексей Алексеевич Заварзин.Здесь он организовал отдел общей морфологии ИЭМ, объединявший на протяжении ряда лет научную жизнь морфологов Ленинграда","1967"," Академика Павлова ул./Санкт-Петербург, д. 12 ",59.977178,30.310573,"мрамор",FALSE,"работал",NA,NA,NA,NA,"5. Zastoi",1967
"232",232,2805544934,"Зараеву А.И.",NA,"Здесь учился и с 1955 по 1992 год работал выдающийся ученый в области теории корабля, руководитель проблемной лаборатории гидродинамики и кафедры теории корабля, заслуженный деятель науки и техники РСФСР, доктор технических наук, профессор Зараев Андрей Иванович","1995"," Адмиралтейский проезд/Санкт-Петербург, д. 2 ",59.938215,30.3092039,"мрамор",FALSE,"учился",NA,NA,NA,NA,"7. Federation",1995
"233",233,2805530639,"Захарову М.В.",NA,"В этом здании работал Маршал Советского Союза Захаров Матвей Васильевич вдолжностях начальника штаба (1937–1938 гг.) и командующего войсками Ленинградского военного округа (1953–1957 гг.)","1973"," Дворцовая пл./Санкт-Петербург, д. 10 ",59.937895,30.3165121,"мрамор",FALSE,"работал",NA,NA,NA,NA,"5. Zastoi",1973
"234",234,2805526815,"Землячке Р.С.",NA,"Здесь, в помещении Технологического института, в 1905–1907 гг. осуществлялись партийные явки Р.С. Землячки, работавшей тогда секретарем Петербургского комитета большевиков","1948"," Московский пр./Санкт-Петербург, д. 26/49 ",59.9183802,30.3182825,"мрамор",FALSE,"работал",NA,NA,NA,NA,"3. Stalin time",1948
"235",235,2805544948,"Зернову  С.А.",NA,"Здесь жил с 1931 года и скончался выдающийся гидробиолог, академик Сергей Алексеевич Зернов. 1871–1945","1962"," Лейтенанта Шмидта наб./Санкт-Петербург, д. 1/2 ",59.936509,30.285463,NA,FALSE,"умер",NA,NA,NA,NA,"4. Ottepel",1962
"236",236,2805544958,"Зинину Н.Н.","Николай Николаевич Зинин","Здесь с 1848 по 1874 г. работал выдающийся русский химик, академик Николай Николаевич Зинин","1955"," Пироговская наб./Санкт-Петербург, д. 1 ",59.9541853,30.3490513,"мрамор",FALSE,"работал",1812-08-25,1880-02-18,"мужской пол","Q520792","4. Ottepel",1955
"237",237,2805544968,"Зинину Н.Н.","Николай Николаевич Зинин","Н.Н. Зинин. 1812–1880","1960-е"," Московский пр./Санкт-Петербург, д. 26/49 ",59.9183802,30.3182825,"металл",FALSE,NA,1812-08-25,1880-02-18,"мужской пол","Q520792","4. Ottepel",1960
"238",238,2805551832,"Зощенко М.М.","Михаил Михайлович Зощенко","В этом доме в 1934–1958 годах жил и работал писатель Михаил Михайлович Зощенко","1994"," кан. Грибоедова наб./Санкт-Петербург, д. 9 ",59.938356,30.326949,"бронза",TRUE,"жил и работал",1894-08-09,1958-07-22,"мужской пол","Q360507","7. Federation",1994
"239",239,2805551862,"Зощенко М.М.","Михаил Михайлович Зощенко","Сестрорецкая районная библиотека носит имя М. Зощенко","1997"," Токарева ул./Сестрорецк г., д. 7 ",60.0880531,29.9559262,"гранит",TRUE,"название в честь",1894-08-09,1958-07-22,"мужской пол","Q360507","7. Federation",1997
"240",240,2805551882,"Иванову В.И.","Векслер, Иван Иванович","В этом доме, на “башне” Вячеслава Иванова, в 1905–1912 годах собирались деятели русской культуры, поэты, философы, художники. Commune de Neuvecelle — Mai 1993","1994"," Таврическая ул./Санкт-Петербург, д. 35 ",59.946529,30.379035,"гранит",FALSE,NA,1885-08-27,1954-04-24,"мужской пол","Q64439794","7. Federation",1994
"241",241,2805551872,"Иванову В.В.","Иванов, Владимир Владимирович","В этом доме с 1920 по 1924 год жил писатель Всеволод Вячеславович Иванов","1966"," Б. Сампсониевский пр./Санкт-Петербург, д. 4 ",59.9578,30.3438591,"мрамор",FALSE,"жил",1873-06-23,1931-09-13,"мужской пол","Q41597169","5. Zastoi",1966
"242",242,2805551911,"Иванову Е.С ","Ендогуров, Сергей Иванович","Участникам беспримерного перехода Ленинград — Хабаровск 9 тысяч километров за 145 ходовых дней, совершенного комсомольцами-призывниками завода “Красная заря” к месту воинской службы в 1935 году: Иванову Е.С., Чистякову И.В., Ананьеву П.Ф., Бренчанинову П.С., Васильеву В.Ф., Носову А.В. Маршрут Ленинград — Хабаровск. 1.05.1935 г.–30.10.1935 г. От трудящихся ЛНПО “Красная заря” в честь 50-летия перехода 1.05.1985 года","1985","Б. Сампсониевский пр./Санкт-Петербург, д. 60",59.974504,30.338968,"латунь",FALSE,"работал",1864-10-11,1894-12-04,"мужской пол","Q4175594","6. Perestroika",1985
"243",243,2805544982,"Изотову С.П.","Изотов, Сергей Петрович","Здесь с 1946 по 1983 год работал видный ученый, генеральный конструктор авиационных двигателей, Герой Социалистического Труда, лауреат Ленинской и Государственных премий СССР, доктор технических наук Сергей Петрович Изотов","1986"," Кантемировская ул./Санкт-Петербург, д. 13 ",59.9842807,30.3369784,"гранит",TRUE,"работал",1917-06-30,1983-05-06,"мужской пол","Q329302","6. Perestroika",1986
"244",244,2805545047,"Иоффе А.Ф.","Абрам Фёдорович Иоффе","Здесь работал с 1924 года по 1979 год выдающийся микробиолог, иммунолог, эпидемиолог, академик АМН СССР Владимир Ильич Иоффе, основоположник клинической иммунологии","1993"," Академика Павлова ул./Санкт-Петербург, д. 12 ",59.977178,30.310573,"гранит",TRUE,"работал",1880-10-29,1960-10-14,"мужской пол","Q331067","7. Federation",1993
"245",245,2805544994,"Иоффе А.Ф.","Абрам Фёдорович Иоффе","Здесь в 1932–1960 гг. работал академик А.Ф. Иоффе, создатель современной школы агрофизиков","1961"," Гражданский пр./Санкт-Петербург, д. 14 ",60.00059,30.384073,"мрамор",FALSE,"работал",1880-10-29,1960-10-14,"мужской пол","Q331067","4. Ottepel",1961
"246",246,2805545014,"Иоффе А.Ф.","Абрам Фёдорович Иоффе","Здесь в 1906–1948 гг. работал выдающийся советский физик, академик А.Ф. Иоффе, основатель физико-механического факультета института","1983"," Политехническая ул./Санкт-Петербург, д. 29 ",60.0077249,30.3732928,"мрамор",FALSE,"основал",1880-10-29,1960-10-14,"мужской пол","Q331067","5. Zastoi",1983
"247",247,2805545004,"Иоффе А.Ф.","Абрам Фёдорович Иоффе","Здесь в 1952–1960 гг. работал крупнейший ученый-физик, академик А.Ф. Иоффе, основатель института полупроводников Академии наук СССР","1961"," Кутузова наб./Санкт-Петербург, д. 10 ",59.9491363,30.3450142,"мрамор",FALSE,"основал",1880-10-29,1960-10-14,"мужской пол","Q331067","4. Ottepel",1961
"248",248,2805551922,"Исаевой В.В.","Исаева, Вера Васильевна","Здесь с 1916 по 1960 год жила скульптор Вера Васильевна Исаева, создатель монумента Матери-Родины на Пискаревском мемориальном кладбище","1995"," Подковырова ул./Санкт-Петербург, д. 25 ",59.9640818,30.3035,"гранит",TRUE,"жил",1898-04-10,1960-04-19,"женский пол","Q4203576","7. Federation",1995
"249",249,2805545060,"Исаеву В.И.","Исаев, Василий Исаевич","Здесь жил и работал с 1894 по 1911 г. главный доктор Кронштадского морского госпиталя Василий Исаевич Исаев. 1854–1911","До 1978"," Мануильского ул./Кронштадт г., д. 2 ",59.991694,29.7927309,"мрамор",FALSE,"жил и работал",1854-05-22,1911-05-25,"мужской пол","Q22016645","5. Zastoi",1978
"250",250,2805545071,"Исанину Н.Н.","Николай Никитич Исанин","В этом здании работал выдающийся кораблестроитель, академик Николай Никитич Исанин (1904–1990)","1994","Фрунзе ул./Санкт-Петербург, д. 18",59.862153,30.331166,"гранит",FALSE,"работал",1904-05-05,1990-03-01,"мужской пол","Q4203734","7. Federation",1994
"251",251,2805551945,"Кадочникову П.П.","Пётр Павлович Кадочников","В этом доме с 1952 по 1988 год жил Павел Петрович Кадочников, народный артист СССР, Герой Социалистического Труда","1993"," Каменноостровский пр./Санкт-Петербург, д. 2 ",59.957176,30.3195211,"гранит",FALSE,"жил",1944-12-27,1981-07-21,"мужской пол","Q4207326","7. Federation",1993
"252",252,2805530667,"Казакову В.И.",NA,"Здесь в 1918 году на артиллерийских курсах учился видный военачальник, Герой Советского Союза, маршал артиллерии Василий Иванович Казаков","1969"," Московский пр./Санкт-Петербург, д. 17 ",59.918772,30.316462,"бронза",TRUE,"учился",NA,NA,NA,NA,"5. Zastoi",1969
"253",253,2805545082,"Кайгородову Д.Н.","Кайгородов, Дмитрий Никифорович","Здесь жил и работал Дмитрий Никифорович Кайгородов.Родился 1846 г. 31 Авг. Умер 1924 г. 11 Февр.","1925"," Институтский пр./Санкт-Петербург, д. 21, лит. А ",60.003367,30.350439,"мрамор",FALSE,"жил и работал",1846-09-12,1924-02-11,"мужской пол","Q4208585","2. Early soviet",1925
"254",254,2805545092,"Калеснику С.В.","Станислав Викентьевич Калесник","Выдающийся советский географ, лимнолог и гляциолог, академик Станислав Викентьевич Калесник работал директором Института озероведения АН СССР с 1955 по 1976 год","1984"," Севастьянова ул./Санкт-Петербург, д. 9 ",59.874774,30.32992,"мрамор",FALSE,"работал",1901-01-23,1977-09-13,"мужской пол","Q3648056","5. Zastoi",1984
"255",255,2805527011,"Калинину М.И.",NA,"Эта комната в сентябре-ноябре 1917 года была рабочим кабинетом М.И. Калинина — председателя управы Лесновско-Удельнинской районной думы","1977","Болотная ул./Санкт-Петербург, д. 13",60.0011,30.354538,"мрамор",FALSE,"работал",1818-04-29,1881-03-13,"мужской пол","Q83171","5. Zastoi",1977
"256",256,2805526923,"Калинину М.И.",NA,"Здесь работал Михаил Иванович Калинин в 1917–1918 годах председателем Петроградской городской думы и с августа 1918 по март 1919 года комиссаром городского хозяйства Петроградской трудовой коммуны","1948"," Невский пр./Санкт-Петербург, д. 33 ",59.9345169,30.329375,NA,TRUE,"работал",1818-04-29,1881-03-13,"мужской пол","Q83171","3. Stalin time",1948
"257",257,2805526943,"Калинину М.И.",NA,"Здесь, в актовом зале института, 17 мая 1917 года Михаил Иванович Калининпредседательствовал на митинге рабочих и студентов, на котором выступил с речью Владимир Ильич Ленин. Здесь же 16 октября 1927 г. Михаил Иванович произнес приветственную речь по случаю 25-летия Политехнического института","1948"," Политехническая ул./Санкт-Петербург, д. 29 ",60.0077249,30.3732928,NA,TRUE,"выступал",1818-04-29,1881-03-13,"мужской пол","Q83171","3. Stalin time",1948
"258",258,2805526955,"Калинину М.И.",NA,"На этом заводе в 1896–1899 и 1905–1906 годах работал Михаил Иванович Калинин.Здесь он определился как революционер-профессионал","1948"," Стачек пр./Санкт-Петербург, д. 47 ",59.8808948,30.2607868,NA,TRUE,"работал",1818-04-29,1881-03-13,"мужской пол","Q83171","3. Stalin time",1948
"259",259,2805526967,"Калинину М.И.",NA,"На этом заводе в 1913–1916 годах работал Михаил Иванович Калинин","1948"," Энгельса пр./Санкт-Петербург, д. 25 ",60.004152,30.328258,"мрамор",FALSE,"работал",1818-04-29,1881-03-13,"мужской пол","Q83171","3. Stalin time",1948
"260",260,2805526897,"Калинину М.И.",NA,"Здесь, на бывшем патронном заводе “Старый арсенал”, в 1893–1896 годах работал Михаил Иванович Калинин","1948"," Литейный пр./Санкт-Петербург, д. 3/21 ",59.947908,30.348345,NA,TRUE,"работал",1818-04-29,1881-03-13,"мужской пол","Q83171","3. Stalin time",1948
"261",261,2805526888,"Калинину М.И.",NA,"В этом здании с 1893 г. по 1896 г. на бывшем военном патронном заводе “Старый арсенал” и с 1911 г. по 1913 г. на бывшем орудийном заводе работал Михаил Иванович Калинин","1948"," Литейный пр./Санкт-Петербург, д. 3/14 ",59.947908,30.348345,"мрамор",FALSE,"работал",1818-04-29,1881-03-13,"мужской пол","Q83171","3. Stalin time",1948
"262",262,2805526866,"Калинину М.И.",NA,"Здесь, на орудийном заводе, в 1911–1913 гг. работал Михаил Иванович Калинин","1948"," Литейный пр./Санкт-Петербург, д. 3/14 ",59.947908,30.348345,NA,TRUE,"работал",1818-04-29,1881-03-13,"мужской пол","Q83171","3. Stalin time",1948
"263",263,2805526854,"Калинину М.И.",NA,"Здесь в 1918 году жил Михаил Иванович Калинин","1947"," Куйбышева ул./Санкт-Петербург, д. 4 ",59.954728,30.325608,"мрамор",FALSE,"жил",1818-04-29,1881-03-13,"мужской пол","Q83171","3. Stalin time",1947
"264",264,2805526845,"Калинину М.И.",NA,"На этом станке в 1906, 1907 и 1917 гг. работал М.И. Калинин","1940-е"," Уральская ул./Санкт-Петербург, д. 3 ",59.9500485,30.2689612,"металл",FALSE,"работал",1818-04-29,1881-03-13,"мужской пол","Q83171","3. Stalin time",1940
"265",265,2805526836,"Калинину М.И.",NA,"Калинин Михаил Иванович. 1875–1946. Родом из Тверской губернии. С 1893 г. Калинин работает на петербургском заводе “Старый арсенал”. В 1898 г. вступает в ряды РСДРП. В 1906 г. М.И. Калинин работает на Трубочном заводе, избирается членом Петербургского комитета РСДРП. 30 ноября 1907 г. его увольняют из инструментальной мастерской за революционную деятельность. В 1917 г. Калинин вновь поступает на Трубочный завод, где возглавляет работу по подготовке к вооруженному восстанию. В 1944 г. в связи с 25-летием пребывания на посту Председателя ВЦИК ему присвоено звание Героя Социалистического Труда. М.И. Калинин всю жизнь не порывал связи с заводом. На третьем этаже здания, в бывшей инструментальной мастерской установлен токарный станок, на котором работал М.И. Калинин. Его имя присвоено заводу в 1923 г.","1940-е"," Уральская ул./Санкт-Петербург, д. 3 ",59.9500485,30.2689612,"мрамор",FALSE,"работал",1818-04-29,1881-03-13,"мужской пол","Q83171","3. Stalin time",1940
"266",266,2805526977,"Калинину М.И.",NA,"В этом доме в 1918 году жил Михаил Иванович Калинин","1957"," Куйбышева ул./Санкт-Петербург, д. 4 ",59.954728,30.325608,"мрамор",FALSE,"жил",1818-04-29,1881-03-13,"мужской пол","Q83171","4. Ottepel",1957
"267",267,2805527021,"Калинину М.И.",NA,"В этом здании 24 декабря 1919 года на торжественном собрании Уездного Петергофского комитета партии выступал Калинин Михаил Иванович","1983"," Калининская ул./Петергоф г., д. 7 ",59.881983,29.9117091,NA,FALSE,"выступал",1818-04-29,1881-03-13,"мужской пол","Q83171","5. Zastoi",1983
"268",268,2805526998,"Калинину М.И.",NA,"Здесь в 1917 г. помещалась Лесновско-Удельнинская районная управа, председателем которой был Михаил Иванович Калинин","1965","Болотная ул./Санкт-Петербург, д. 13",60.0011,30.354538,"гранит",FALSE,"руководил",1818-04-29,1881-03-13,"мужской пол","Q83171","5. Zastoi",1965
"269",269,2805526988,"Калинину М.И.",NA,"В этом доме в 1899 году поселился приехавший в Петербург 14-летний Михаил Калинин и прожил здесь до 1896 года","1962"," Гангутская ул./Санкт-Петербург, д. 12 ",59.9450123,30.3407071,"гранит",TRUE,"жил",1818-04-29,1881-03-13,"мужской пол","Q83171","4. Ottepel",1962
"270",270,2805527030,"Калинину Я.А.","Калинин, Яков Андреевич","Калинин Яков Андреевич, рабочий фабрики “Скороход”, руководитель партийного коллектива большевиков, член Московского районного комитета РКП (б) и фабричного комитета профсоюза кожевников 1-го созыва, вел активную революционную деятельность. Зверски убит эсерами 1 апреля 1919 г. По просьбе трудящихся имя Якова Калинина присвоено фабрике “Скороход”","1957","Заставская ул./Санкт-Петербург, д. 33",59.8898901,30.3169296,"мрамор",TRUE,"убит",1818-04-29,1881-03-13,"мужской пол","Q83171","4. Ottepel",1957
"271",271,2805527042,"Калинину Я.А.","Калинин, Яков Андреевич","Здесь убит 1/IV 1919 г. белогвардейской рукой за активную революционную работу рабочий Яков Калинин. Не сожаление, а героическая борьба наша — память о нем. Рабочие ф-ки “Скороход” — его имени","1920-е"," Заставская ул./Санкт-Петербург, д. 38 ",59.888608,30.3205681,"мрамор",FALSE,"название в честь",1818-04-29,1881-03-13,"мужской пол","Q83171","2. Early soviet",1920
"272",272,2805545116,"Капице П.Л.","Леонид Петрович Капица","В этом здании, бывшем реальном училище, в 1907–1912 годах учился Петр Леонидович Капица, выдающийся советский физик, академик, дважды Герой Социалистического Труда, лауреат Нобелевской премии","1995"," Урицкого ул./Кронштадт г., д. 7/1 ",59.9959303,29.7655453,"гранит",FALSE,"учился",1818-04-29,1881-03-13,"мужской пол","Q83171","7. Federation",1995
"273",273,2805545104,"Капице П.Л.","Леонид Петрович Капица","Здесь учился и работал с 1912 по 1921 год академик Капица Петр Леонидович(1894–1984), лауреат Нобелевской премии, дважды Герой Социалистического Труда","1993"," Политехническая ул./Санкт-Петербург, д. 29 ",60.0077249,30.3732928,"гранит",FALSE,"учился",1818-04-29,1881-03-13,"мужской пол","Q83171","7. Federation",1993
"274",274,2805551963,"Капнисту В.В.",NA,"В этом доме в 1790–1793 годы жил поэт, драматург, переводчик Василий Васильевич Капнист","1997"," Загородный пр./Санкт-Петербург, д. 18/2 ",59.9261424,30.3430049,"гранит",FALSE,"жил",NA,NA,NA,NA,"7. Federation",1997
"275",275,2805527069,"Капранову В.П.",NA,"Капранов Виктор Павлович. Старый ленинградский рабочий-кожевник. Член ВКП (б) с 1908 года. Один из руководителей петербургского профсоюза рабочих-кожевников в 1914 году. За революционную деятельность в годы царизма дважды подвергался ссылке и тюремному заключению. Председатель и секретарь Ц.К. союза кожевников 1918–1930 гг. Член ВЦИК и ЦКК ряда созывов и член Международного Комитета пропаганды и действия революционных кожевников. 1887–1930 гг.","1934"," Московский пр./Санкт-Петербург, д. 97 ",59.893719,30.31756,"мрамор",FALSE,"руководил",NA,NA,NA,NA,"3. Stalin time",1934
